No.     Time           Source                Destination           Protocol Length Info
     13 3.834732675    127.0.0.1             127.0.0.1             TCP      74     48184 → 10001 [SYN] Seq=0 Win=65495 Len=0 MSS=65495 SACK_PERM=1 TSval=3259702160 TSecr=0 WS=128

Frame 13: 74 bytes on wire (592 bits), 74 bytes captured (592 bits) on interface 0
Ethernet II, Src: 00:00:00_00:00:00 (00:00:00:00:00:00), Dst: 00:00:00_00:00:00 (00:00:00:00:00:00)
Internet Protocol Version 4, Src: 127.0.0.1, Dst: 127.0.0.1
Transmission Control Protocol, Src Port: 48184, Dst Port: 10001, Seq: 0, Len: 0
    Source Port: 48184
    Destination Port: 10001
    [Stream index: 0]
    [TCP Segment Len: 0]
    Sequence number: 0    (relative sequence number)
    [Next sequence number: 0    (relative sequence number)]
    Acknowledgment number: 0
    1010 .... = Header Length: 40 bytes (10)
    Flags: 0x002 (SYN)
    Window size value: 65495
    [Calculated window size: 65495]
    Checksum: 0xfe30 [unverified]
    [Checksum Status: Unverified]
    Urgent pointer: 0
    Options: (20 bytes), Maximum segment size, SACK permitted, Timestamps, No-Operation (NOP), Window scale
    [Timestamps]
        [Time since first frame in this TCP stream: 0.000000000 seconds]
        [Time since previous frame in this TCP stream: 0.000000000 seconds]

No.     Time           Source                Destination           Protocol Length Info
     14 3.834761507    127.0.0.1             127.0.0.1             TCP      74     10001 → 48184 [SYN, ACK] Seq=0 Ack=1 Win=65483 Len=0 MSS=65495 SACK_PERM=1 TSval=3259702160 TSecr=3259702160 WS=128

Frame 14: 74 bytes on wire (592 bits), 74 bytes captured (592 bits) on interface 0
Ethernet II, Src: 00:00:00_00:00:00 (00:00:00:00:00:00), Dst: 00:00:00_00:00:00 (00:00:00:00:00:00)
Internet Protocol Version 4, Src: 127.0.0.1, Dst: 127.0.0.1
Transmission Control Protocol, Src Port: 10001, Dst Port: 48184, Seq: 0, Ack: 1, Len: 0
    Source Port: 10001
    Destination Port: 48184
    [Stream index: 0]
    [TCP Segment Len: 0]
    Sequence number: 0    (relative sequence number)
    [Next sequence number: 0    (relative sequence number)]
    Acknowledgment number: 1    (relative ack number)
    1010 .... = Header Length: 40 bytes (10)
    Flags: 0x012 (SYN, ACK)
    Window size value: 65483
    [Calculated window size: 65483]
    Checksum: 0xfe30 [unverified]
    [Checksum Status: Unverified]
    Urgent pointer: 0
    Options: (20 bytes), Maximum segment size, SACK permitted, Timestamps, No-Operation (NOP), Window scale
    [SEQ/ACK analysis]
    [Timestamps]
        [Time since first frame in this TCP stream: 0.000028832 seconds]
        [Time since previous frame in this TCP stream: 0.000028832 seconds]

No.     Time           Source                Destination           Protocol Length Info
     15 3.834786810    127.0.0.1             127.0.0.1             TCP      66     48184 → 10001 [ACK] Seq=1 Ack=1 Win=65536 Len=0 TSval=3259702160 TSecr=3259702160

Frame 15: 66 bytes on wire (528 bits), 66 bytes captured (528 bits) on interface 0
Ethernet II, Src: 00:00:00_00:00:00 (00:00:00:00:00:00), Dst: 00:00:00_00:00:00 (00:00:00:00:00:00)
Internet Protocol Version 4, Src: 127.0.0.1, Dst: 127.0.0.1
Transmission Control Protocol, Src Port: 48184, Dst Port: 10001, Seq: 1, Ack: 1, Len: 0
    Source Port: 48184
    Destination Port: 10001
    [Stream index: 0]
    [TCP Segment Len: 0]
    Sequence number: 1    (relative sequence number)
    [Next sequence number: 1    (relative sequence number)]
    Acknowledgment number: 1    (relative ack number)
    1000 .... = Header Length: 32 bytes (8)
    Flags: 0x010 (ACK)
    Window size value: 512
    [Calculated window size: 65536]
    [Window size scaling factor: 128]
    Checksum: 0xfe28 [unverified]
    [Checksum Status: Unverified]
    Urgent pointer: 0
    Options: (12 bytes), No-Operation (NOP), No-Operation (NOP), Timestamps
    [SEQ/ACK analysis]
    [Timestamps]
        [Time since first frame in this TCP stream: 0.000054135 seconds]
        [Time since previous frame in this TCP stream: 0.000025303 seconds]

No.     Time           Source                Destination           Protocol Length Info
     56 108.498569021  127.0.0.1             127.0.0.1             TCP      72     48184 → 10001 [PSH, ACK] Seq=1 Ack=1 Win=65536 Len=6 TSval=3259806824 TSecr=3259702160

Frame 56: 72 bytes on wire (576 bits), 72 bytes captured (576 bits) on interface 0
Ethernet II, Src: 00:00:00_00:00:00 (00:00:00:00:00:00), Dst: 00:00:00_00:00:00 (00:00:00:00:00:00)
Internet Protocol Version 4, Src: 127.0.0.1, Dst: 127.0.0.1
Transmission Control Protocol, Src Port: 48184, Dst Port: 10001, Seq: 1, Ack: 1, Len: 6
    Source Port: 48184
    Destination Port: 10001
    [Stream index: 0]
    [TCP Segment Len: 6]
    Sequence number: 1    (relative sequence number)
    [Next sequence number: 7    (relative sequence number)]
    Acknowledgment number: 1    (relative ack number)
    1000 .... = Header Length: 32 bytes (8)
    Flags: 0x018 (PSH, ACK)
    Window size value: 512
    [Calculated window size: 65536]
    [Window size scaling factor: 128]
    Checksum: 0xfe2e [unverified]
    [Checksum Status: Unverified]
    Urgent pointer: 0
    Options: (12 bytes), No-Operation (NOP), No-Operation (NOP), Timestamps
    [SEQ/ACK analysis]
    [Timestamps]
        [Time since first frame in this TCP stream: 104.663836346 seconds]
        [Time since previous frame in this TCP stream: 104.663782211 seconds]
    TCP payload (6 bytes)
Data (6 bytes)

0000  51 43 20 30 32 0a                                 QC 02.
    Data: 51432030320a
    [Length: 6]

No.     Time           Source                Destination           Protocol Length Info
     57 108.498602017  127.0.0.1             127.0.0.1             TCP      66     10001 → 48184 [ACK] Seq=1 Ack=7 Win=65536 Len=0 TSval=3259806824 TSecr=3259806824

Frame 57: 66 bytes on wire (528 bits), 66 bytes captured (528 bits) on interface 0
Ethernet II, Src: 00:00:00_00:00:00 (00:00:00:00:00:00), Dst: 00:00:00_00:00:00 (00:00:00:00:00:00)
Internet Protocol Version 4, Src: 127.0.0.1, Dst: 127.0.0.1
Transmission Control Protocol, Src Port: 10001, Dst Port: 48184, Seq: 1, Ack: 7, Len: 0
    Source Port: 10001
    Destination Port: 48184
    [Stream index: 0]
    [TCP Segment Len: 0]
    Sequence number: 1    (relative sequence number)
    [Next sequence number: 1    (relative sequence number)]
    Acknowledgment number: 7    (relative ack number)
    1000 .... = Header Length: 32 bytes (8)
    Flags: 0x010 (ACK)
    Window size value: 512
    [Calculated window size: 65536]
    [Window size scaling factor: 128]
    Checksum: 0xfe28 [unverified]
    [Checksum Status: Unverified]
    Urgent pointer: 0
    Options: (12 bytes), No-Operation (NOP), No-Operation (NOP), Timestamps
    [SEQ/ACK analysis]
    [Timestamps]
        [Time since first frame in this TCP stream: 104.663869342 seconds]
        [Time since previous frame in this TCP stream: 0.000032996 seconds]

No.     Time           Source                Destination           Protocol Length Info
     58 108.498768175  127.0.0.1             127.0.0.1             TCP      74     38534 → 10002 [SYN] Seq=0 Win=65495 Len=0 MSS=65495 SACK_PERM=1 TSval=3259806824 TSecr=0 WS=128

Frame 58: 74 bytes on wire (592 bits), 74 bytes captured (592 bits) on interface 0
Ethernet II, Src: 00:00:00_00:00:00 (00:00:00:00:00:00), Dst: 00:00:00_00:00:00 (00:00:00:00:00:00)
Internet Protocol Version 4, Src: 127.0.0.1, Dst: 127.0.0.1
Transmission Control Protocol, Src Port: 38534, Dst Port: 10002, Seq: 0, Len: 0
    Source Port: 38534
    Destination Port: 10002
    [Stream index: 1]
    [TCP Segment Len: 0]
    Sequence number: 0    (relative sequence number)
    [Next sequence number: 0    (relative sequence number)]
    Acknowledgment number: 0
    1010 .... = Header Length: 40 bytes (10)
    Flags: 0x002 (SYN)
    Window size value: 65495
    [Calculated window size: 65495]
    Checksum: 0xfe30 [unverified]
    [Checksum Status: Unverified]
    Urgent pointer: 0
    Options: (20 bytes), Maximum segment size, SACK permitted, Timestamps, No-Operation (NOP), Window scale
    [Timestamps]
        [Time since first frame in this TCP stream: 0.000000000 seconds]
        [Time since previous frame in this TCP stream: 0.000000000 seconds]

No.     Time           Source                Destination           Protocol Length Info
     59 108.498788119  127.0.0.1             127.0.0.1             TCP      74     10002 → 38534 [SYN, ACK] Seq=0 Ack=1 Win=65483 Len=0 MSS=65495 SACK_PERM=1 TSval=3259806824 TSecr=3259806824 WS=128

Frame 59: 74 bytes on wire (592 bits), 74 bytes captured (592 bits) on interface 0
Ethernet II, Src: 00:00:00_00:00:00 (00:00:00:00:00:00), Dst: 00:00:00_00:00:00 (00:00:00:00:00:00)
Internet Protocol Version 4, Src: 127.0.0.1, Dst: 127.0.0.1
Transmission Control Protocol, Src Port: 10002, Dst Port: 38534, Seq: 0, Ack: 1, Len: 0
    Source Port: 10002
    Destination Port: 38534
    [Stream index: 1]
    [TCP Segment Len: 0]
    Sequence number: 0    (relative sequence number)
    [Next sequence number: 0    (relative sequence number)]
    Acknowledgment number: 1    (relative ack number)
    1010 .... = Header Length: 40 bytes (10)
    Flags: 0x012 (SYN, ACK)
    Window size value: 65483
    [Calculated window size: 65483]
    Checksum: 0xfe30 [unverified]
    [Checksum Status: Unverified]
    Urgent pointer: 0
    Options: (20 bytes), Maximum segment size, SACK permitted, Timestamps, No-Operation (NOP), Window scale
    [SEQ/ACK analysis]
    [Timestamps]
        [Time since first frame in this TCP stream: 0.000019944 seconds]
        [Time since previous frame in this TCP stream: 0.000019944 seconds]

No.     Time           Source                Destination           Protocol Length Info
     60 108.498807593  127.0.0.1             127.0.0.1             TCP      66     38534 → 10002 [ACK] Seq=1 Ack=1 Win=65536 Len=0 TSval=3259806824 TSecr=3259806824

Frame 60: 66 bytes on wire (528 bits), 66 bytes captured (528 bits) on interface 0
Ethernet II, Src: 00:00:00_00:00:00 (00:00:00:00:00:00), Dst: 00:00:00_00:00:00 (00:00:00:00:00:00)
Internet Protocol Version 4, Src: 127.0.0.1, Dst: 127.0.0.1
Transmission Control Protocol, Src Port: 38534, Dst Port: 10002, Seq: 1, Ack: 1, Len: 0
    Source Port: 38534
    Destination Port: 10002
    [Stream index: 1]
    [TCP Segment Len: 0]
    Sequence number: 1    (relative sequence number)
    [Next sequence number: 1    (relative sequence number)]
    Acknowledgment number: 1    (relative ack number)
    1000 .... = Header Length: 32 bytes (8)
    Flags: 0x010 (ACK)
    Window size value: 512
    [Calculated window size: 65536]
    [Window size scaling factor: 128]
    Checksum: 0xfe28 [unverified]
    [Checksum Status: Unverified]
    Urgent pointer: 0
    Options: (12 bytes), No-Operation (NOP), No-Operation (NOP), Timestamps
    [SEQ/ACK analysis]
    [Timestamps]
        [Time since first frame in this TCP stream: 0.000039418 seconds]
        [Time since previous frame in this TCP stream: 0.000019474 seconds]

No.     Time           Source                Destination           Protocol Length Info
     61 108.498882593  127.0.0.1             127.0.0.1             TCP      91     38534 → 10002 [PSH, ACK] Seq=1 Ack=1 Win=65536 Len=25 TSval=3259806824 TSecr=3259806824

Frame 61: 91 bytes on wire (728 bits), 91 bytes captured (728 bits) on interface 0
Ethernet II, Src: 00:00:00_00:00:00 (00:00:00:00:00:00), Dst: 00:00:00_00:00:00 (00:00:00:00:00:00)
Internet Protocol Version 4, Src: 127.0.0.1, Dst: 127.0.0.1
Transmission Control Protocol, Src Port: 38534, Dst Port: 10002, Seq: 1, Ack: 1, Len: 25
    Source Port: 38534
    Destination Port: 10002
    [Stream index: 1]
    [TCP Segment Len: 25]
    Sequence number: 1    (relative sequence number)
    [Next sequence number: 26    (relative sequence number)]
    Acknowledgment number: 1    (relative ack number)
    1000 .... = Header Length: 32 bytes (8)
    Flags: 0x018 (PSH, ACK)
    Window size value: 512
    [Calculated window size: 65536]
    [Window size scaling factor: 128]
    Checksum: 0xfe41 [unverified]
    [Checksum Status: Unverified]
    Urgent pointer: 0
    Options: (12 bytes), No-Operation (NOP), No-Operation (NOP), Timestamps
    [SEQ/ACK analysis]
    [Timestamps]
        [Time since first frame in this TCP stream: 0.000114418 seconds]
        [Time since previous frame in this TCP stream: 0.000075000 seconds]
    TCP payload (25 bytes)
Data (25 bytes)

0000  01 4c 49 53 54 53 45 52 56 45 52 53 2c 50 33 5f   .LISTSERVERS,P3_
0010  47 52 4f 55 50 5f 32 30 04                        GROUP_20.
    Data: 014c495354534552564552532c50335f47524f55505f3230...
    [Length: 25]

No.     Time           Source                Destination           Protocol Length Info
     62 108.498890946  127.0.0.1             127.0.0.1             TCP      66     10002 → 38534 [ACK] Seq=1 Ack=26 Win=65536 Len=0 TSval=3259806824 TSecr=3259806824

Frame 62: 66 bytes on wire (528 bits), 66 bytes captured (528 bits) on interface 0
Ethernet II, Src: 00:00:00_00:00:00 (00:00:00:00:00:00), Dst: 00:00:00_00:00:00 (00:00:00:00:00:00)
Internet Protocol Version 4, Src: 127.0.0.1, Dst: 127.0.0.1
Transmission Control Protocol, Src Port: 10002, Dst Port: 38534, Seq: 1, Ack: 26, Len: 0
    Source Port: 10002
    Destination Port: 38534
    [Stream index: 1]
    [TCP Segment Len: 0]
    Sequence number: 1    (relative sequence number)
    [Next sequence number: 1    (relative sequence number)]
    Acknowledgment number: 26    (relative ack number)
    1000 .... = Header Length: 32 bytes (8)
    Flags: 0x010 (ACK)
    Window size value: 512
    [Calculated window size: 65536]
    [Window size scaling factor: 128]
    Checksum: 0xfe28 [unverified]
    [Checksum Status: Unverified]
    Urgent pointer: 0
    Options: (12 bytes), No-Operation (NOP), No-Operation (NOP), Timestamps
    [SEQ/ACK analysis]
    [Timestamps]
        [Time since first frame in this TCP stream: 0.000122771 seconds]
        [Time since previous frame in this TCP stream: 0.000008353 seconds]

No.     Time           Source                Destination           Protocol Length Info
     63 108.499704396  127.0.0.1             127.0.0.1             TCP      107    10002 → 38534 [PSH, ACK] Seq=1 Ack=26 Win=65536 Len=41 TSval=3259806825 TSecr=3259806824

Frame 63: 107 bytes on wire (856 bits), 107 bytes captured (856 bits) on interface 0
Ethernet II, Src: 00:00:00_00:00:00 (00:00:00:00:00:00), Dst: 00:00:00_00:00:00 (00:00:00:00:00:00)
Internet Protocol Version 4, Src: 127.0.0.1, Dst: 127.0.0.1
Transmission Control Protocol, Src Port: 10002, Dst Port: 38534, Seq: 1, Ack: 26, Len: 41
    Source Port: 10002
    Destination Port: 38534
    [Stream index: 1]
    [TCP Segment Len: 41]
    Sequence number: 1    (relative sequence number)
    [Next sequence number: 42    (relative sequence number)]
    Acknowledgment number: 26    (relative ack number)
    1000 .... = Header Length: 32 bytes (8)
    Flags: 0x018 (PSH, ACK)
    Window size value: 512
    [Calculated window size: 65536]
    [Window size scaling factor: 128]
    Checksum: 0xfe51 [unverified]
    [Checksum Status: Unverified]
    Urgent pointer: 0
    Options: (12 bytes), No-Operation (NOP), No-Operation (NOP), Timestamps
    [SEQ/ACK analysis]
    [Timestamps]
        [Time since first frame in this TCP stream: 0.000936221 seconds]
        [Time since previous frame in this TCP stream: 0.000813450 seconds]
    TCP payload (41 bytes)
Data (41 bytes)

0000  01 53 45 52 56 45 52 53 2c 50 33 5f 47 52 4f 55   .SERVERS,P3_GROU
0010  50 5f 31 30 30 2c 31 30 2e 33 2e 31 37 2e 31 34   P_100,10.3.17.14
0020  31 2c 31 30 30 30 32 3b 04                        1,10002;.
    Data: 01534552564552532c50335f47524f55505f3130302c3130...
    [Length: 41]

No.     Time           Source                Destination           Protocol Length Info
     64 108.499716345  127.0.0.1             127.0.0.1             TCP      66     38534 → 10002 [ACK] Seq=26 Ack=42 Win=65536 Len=0 TSval=3259806825 TSecr=3259806825

Frame 64: 66 bytes on wire (528 bits), 66 bytes captured (528 bits) on interface 0
Ethernet II, Src: 00:00:00_00:00:00 (00:00:00:00:00:00), Dst: 00:00:00_00:00:00 (00:00:00:00:00:00)
Internet Protocol Version 4, Src: 127.0.0.1, Dst: 127.0.0.1
Transmission Control Protocol, Src Port: 38534, Dst Port: 10002, Seq: 26, Ack: 42, Len: 0
    Source Port: 38534
    Destination Port: 10002
    [Stream index: 1]
    [TCP Segment Len: 0]
    Sequence number: 26    (relative sequence number)
    [Next sequence number: 26    (relative sequence number)]
    Acknowledgment number: 42    (relative ack number)
    1000 .... = Header Length: 32 bytes (8)
    Flags: 0x010 (ACK)
    Window size value: 512
    [Calculated window size: 65536]
    [Window size scaling factor: 128]
    Checksum: 0xfe28 [unverified]
    [Checksum Status: Unverified]
    Urgent pointer: 0
    Options: (12 bytes), No-Operation (NOP), No-Operation (NOP), Timestamps
    [SEQ/ACK analysis]
    [Timestamps]
        [Time since first frame in this TCP stream: 0.000948170 seconds]
        [Time since previous frame in this TCP stream: 0.000011949 seconds]

No.     Time           Source                Destination           Protocol Length Info
     65 108.499768504  127.0.0.1             127.0.0.1             TCP      92     10002 → 38534 [PSH, ACK] Seq=42 Ack=26 Win=65536 Len=26 TSval=3259806825 TSecr=3259806825

Frame 65: 92 bytes on wire (736 bits), 92 bytes captured (736 bits) on interface 0
Ethernet II, Src: 00:00:00_00:00:00 (00:00:00:00:00:00), Dst: 00:00:00_00:00:00 (00:00:00:00:00:00)
Internet Protocol Version 4, Src: 127.0.0.1, Dst: 127.0.0.1
Transmission Control Protocol, Src Port: 10002, Dst Port: 38534, Seq: 42, Ack: 26, Len: 26
    Source Port: 10002
    Destination Port: 38534
    [Stream index: 1]
    [TCP Segment Len: 26]
    Sequence number: 42    (relative sequence number)
    [Next sequence number: 68    (relative sequence number)]
    Acknowledgment number: 26    (relative ack number)
    1000 .... = Header Length: 32 bytes (8)
    Flags: 0x018 (PSH, ACK)
    Window size value: 512
    [Calculated window size: 65536]
    [Window size scaling factor: 128]
    Checksum: 0xfe42 [unverified]
    [Checksum Status: Unverified]
    Urgent pointer: 0
    Options: (12 bytes), No-Operation (NOP), No-Operation (NOP), Timestamps
    [SEQ/ACK analysis]
    [Timestamps]
        [Time since first frame in this TCP stream: 0.001000329 seconds]
        [Time since previous frame in this TCP stream: 0.000052159 seconds]
    TCP payload (26 bytes)
Data (26 bytes)

0000  01 4c 49 53 54 53 45 52 56 45 52 53 2c 50 33 5f   .LISTSERVERS,P3_
0010  47 52 4f 55 50 5f 31 30 30 04                     GROUP_100.
    Data: 014c495354534552564552532c50335f47524f55505f3130...
    [Length: 26]

No.     Time           Source                Destination           Protocol Length Info
     66 108.499779400  127.0.0.1             127.0.0.1             TCP      66     38534 → 10002 [ACK] Seq=26 Ack=68 Win=65536 Len=0 TSval=3259806825 TSecr=3259806825

Frame 66: 66 bytes on wire (528 bits), 66 bytes captured (528 bits) on interface 0
Ethernet II, Src: 00:00:00_00:00:00 (00:00:00:00:00:00), Dst: 00:00:00_00:00:00 (00:00:00:00:00:00)
Internet Protocol Version 4, Src: 127.0.0.1, Dst: 127.0.0.1
Transmission Control Protocol, Src Port: 38534, Dst Port: 10002, Seq: 26, Ack: 68, Len: 0
    Source Port: 38534
    Destination Port: 10002
    [Stream index: 1]
    [TCP Segment Len: 0]
    Sequence number: 26    (relative sequence number)
    [Next sequence number: 26    (relative sequence number)]
    Acknowledgment number: 68    (relative ack number)
    1000 .... = Header Length: 32 bytes (8)
    Flags: 0x010 (ACK)
    Window size value: 512
    [Calculated window size: 65536]
    [Window size scaling factor: 128]
    Checksum: 0xfe28 [unverified]
    [Checksum Status: Unverified]
    Urgent pointer: 0
    Options: (12 bytes), No-Operation (NOP), No-Operation (NOP), Timestamps
    [SEQ/ACK analysis]
    [Timestamps]
        [Time since first frame in this TCP stream: 0.001011225 seconds]
        [Time since previous frame in this TCP stream: 0.000010896 seconds]

No.     Time           Source                Destination           Protocol Length Info
     75 168.090568461  127.0.0.1             127.0.0.1             TCP      113    48184 → 10001 [PSH, ACK] Seq=7 Ack=1 Win=65536 Len=47 TSval=3259866416 TSecr=3259806824

Frame 75: 113 bytes on wire (904 bits), 113 bytes captured (904 bits) on interface 0
Ethernet II, Src: 00:00:00_00:00:00 (00:00:00:00:00:00), Dst: 00:00:00_00:00:00 (00:00:00:00:00:00)
Internet Protocol Version 4, Src: 127.0.0.1, Dst: 127.0.0.1
Transmission Control Protocol, Src Port: 48184, Dst Port: 10001, Seq: 7, Ack: 1, Len: 47
    Source Port: 48184
    Destination Port: 10001
    [Stream index: 0]
    [TCP Segment Len: 47]
    Sequence number: 7    (relative sequence number)
    [Next sequence number: 54    (relative sequence number)]
    Acknowledgment number: 1    (relative ack number)
    1000 .... = Header Length: 32 bytes (8)
    Flags: 0x018 (PSH, ACK)
    Window size value: 512
    [Calculated window size: 65536]
    [Window size scaling factor: 128]
    Checksum: 0xfe57 [unverified]
    [Checksum Status: Unverified]
    Urgent pointer: 0
    Options: (12 bytes), No-Operation (NOP), No-Operation (NOP), Timestamps
    [SEQ/ACK analysis]
    [Timestamps]
        [Time since first frame in this TCP stream: 164.255835786 seconds]
        [Time since previous frame in this TCP stream: 59.591966444 seconds]
    TCP payload (47 bytes)
Data (47 bytes)

0000  53 45 4e 44 4d 53 47 20 50 33 5f 47 52 4f 55 50   SENDMSG P3_GROUP
0010  5f 31 30 30 20 74 65 73 74 20 6d 65 73 73 61 67   _100 test messag
0020  65 20 66 6f 72 20 67 72 6f 75 70 31 30 30 0a      e for group100.
    Data: 53454e444d53472050335f47524f55505f31303020746573...
    [Length: 47]

No.     Time           Source                Destination           Protocol Length Info
     76 168.090588767  127.0.0.1             127.0.0.1             TCP      66     10001 → 48184 [ACK] Seq=1 Ack=54 Win=65536 Len=0 TSval=3259866416 TSecr=3259866416

Frame 76: 66 bytes on wire (528 bits), 66 bytes captured (528 bits) on interface 0
Ethernet II, Src: 00:00:00_00:00:00 (00:00:00:00:00:00), Dst: 00:00:00_00:00:00 (00:00:00:00:00:00)
Internet Protocol Version 4, Src: 127.0.0.1, Dst: 127.0.0.1
Transmission Control Protocol, Src Port: 10001, Dst Port: 48184, Seq: 1, Ack: 54, Len: 0
    Source Port: 10001
    Destination Port: 48184
    [Stream index: 0]
    [TCP Segment Len: 0]
    Sequence number: 1    (relative sequence number)
    [Next sequence number: 1    (relative sequence number)]
    Acknowledgment number: 54    (relative ack number)
    1000 .... = Header Length: 32 bytes (8)
    Flags: 0x010 (ACK)
    Window size value: 512
    [Calculated window size: 65536]
    [Window size scaling factor: 128]
    Checksum: 0xfe28 [unverified]
    [Checksum Status: Unverified]
    Urgent pointer: 0
    Options: (12 bytes), No-Operation (NOP), No-Operation (NOP), Timestamps
    [SEQ/ACK analysis]
    [Timestamps]
        [Time since first frame in this TCP stream: 164.255856092 seconds]
        [Time since previous frame in this TCP stream: 0.000020306 seconds]

No.     Time           Source                Destination           Protocol Length Info
     77 168.090810703  127.0.0.1             127.0.0.1             TCP      128    38534 → 10002 [PSH, ACK] Seq=26 Ack=68 Win=65536 Len=62 TSval=3259866416 TSecr=3259806825

Frame 77: 128 bytes on wire (1024 bits), 128 bytes captured (1024 bits) on interface 0
Ethernet II, Src: 00:00:00_00:00:00 (00:00:00:00:00:00), Dst: 00:00:00_00:00:00 (00:00:00:00:00:00)
Internet Protocol Version 4, Src: 127.0.0.1, Dst: 127.0.0.1
Transmission Control Protocol, Src Port: 38534, Dst Port: 10002, Seq: 26, Ack: 68, Len: 62
    Source Port: 38534
    Destination Port: 10002
    [Stream index: 1]
    [TCP Segment Len: 62]
    Sequence number: 26    (relative sequence number)
    [Next sequence number: 88    (relative sequence number)]
    Acknowledgment number: 68    (relative ack number)
    1000 .... = Header Length: 32 bytes (8)
    Flags: 0x018 (PSH, ACK)
    Window size value: 512
    [Calculated window size: 65536]
    [Window size scaling factor: 128]
    Checksum: 0xfe66 [unverified]
    [Checksum Status: Unverified]
    Urgent pointer: 0
    Options: (12 bytes), No-Operation (NOP), No-Operation (NOP), Timestamps
    [SEQ/ACK analysis]
    [Timestamps]
        [Time since first frame in this TCP stream: 59.592042528 seconds]
        [Time since previous frame in this TCP stream: 59.591031303 seconds]
    TCP payload (62 bytes)
Data (62 bytes)

0000  01 53 45 4e 44 5f 4d 53 47 2c 50 33 5f 47 52 4f   .SEND_MSG,P3_GRO
0010  55 50 5f 32 30 2c 50 33 5f 47 52 4f 55 50 5f 31   UP_20,P3_GROUP_1
0020  30 30 2c 74 65 73 74 20 6d 65 73 73 61 67 65 20   00,test message 
0030  66 6f 72 20 67 72 6f 75 70 31 30 30 20 04         for group100 .
    Data: 0153454e445f4d53472c50335f47524f55505f32302c5033...
    [Length: 62]

No.     Time           Source                Destination           Protocol Length Info
     78 168.091294384  127.0.0.1             127.0.0.1             TCP      141    10003 → 45686 [PSH, ACK] Seq=1 Ack=1 Win=512 Len=75 TSval=3259866417 TSecr=3259622451

Frame 78: 141 bytes on wire (1128 bits), 141 bytes captured (1128 bits) on interface 0
Ethernet II, Src: 00:00:00_00:00:00 (00:00:00:00:00:00), Dst: 00:00:00_00:00:00 (00:00:00:00:00:00)
Internet Protocol Version 4, Src: 127.0.0.1, Dst: 127.0.0.1
Transmission Control Protocol, Src Port: 10003, Dst Port: 45686, Seq: 1, Ack: 1, Len: 75
    Source Port: 10003
    Destination Port: 45686
    [Stream index: 2]
    [TCP Segment Len: 75]
    Sequence number: 1    (relative sequence number)
    [Next sequence number: 76    (relative sequence number)]
    Acknowledgment number: 1    (relative ack number)
    1000 .... = Header Length: 32 bytes (8)
    Flags: 0x018 (PSH, ACK)
    Window size value: 512
    [Calculated window size: 512]
    [Window size scaling factor: -1 (unknown)]
    Checksum: 0xfe73 [unverified]
    [Checksum Status: Unverified]
    Urgent pointer: 0
    Options: (12 bytes), No-Operation (NOP), No-Operation (NOP), Timestamps
    [SEQ/ACK analysis]
    [Timestamps]
        [Time since first frame in this TCP stream: 0.000000000 seconds]
        [Time since previous frame in this TCP stream: 0.000000000 seconds]
    TCP payload (75 bytes)
Data (75 bytes)

0000  53 50 2c 46 52 4f 4d 20 47 52 4f 55 50 52 65 63   SP,FROM GROUPRec
0010  69 76 65 64 20 66 72 6f 6d 3a 20 32 30 31 39 2f   ived from: 2019/
0020  31 30 2f 31 34 2f 31 35 2d 31 32 2d 33 36 3a 20   10/14/15-12-36: 
0030  0a 74 65 73 74 20 6d 65 73 73 61 67 65 20 66 6f   .test message fo
0040  72 20 67 72 6f 75 70 31 30 30 20                  r group100 
    Data: 53502c46524f4d2047524f5550526563697665642066726f...
    [Length: 75]

No.     Time           Source                Destination           Protocol Length Info
     79 168.091316637  127.0.0.1             127.0.0.1             TCP      66     45686 → 10003 [ACK] Seq=1 Ack=76 Win=512 Len=0 TSval=3259866417 TSecr=3259866417

Frame 79: 66 bytes on wire (528 bits), 66 bytes captured (528 bits) on interface 0
Ethernet II, Src: 00:00:00_00:00:00 (00:00:00:00:00:00), Dst: 00:00:00_00:00:00 (00:00:00:00:00:00)
Internet Protocol Version 4, Src: 127.0.0.1, Dst: 127.0.0.1
Transmission Control Protocol, Src Port: 45686, Dst Port: 10003, Seq: 1, Ack: 76, Len: 0
    Source Port: 45686
    Destination Port: 10003
    [Stream index: 2]
    [TCP Segment Len: 0]
    Sequence number: 1    (relative sequence number)
    [Next sequence number: 1    (relative sequence number)]
    Acknowledgment number: 76    (relative ack number)
    1000 .... = Header Length: 32 bytes (8)
    Flags: 0x010 (ACK)
    Window size value: 512
    [Calculated window size: 512]
    [Window size scaling factor: -1 (unknown)]
    Checksum: 0xfe28 [unverified]
    [Checksum Status: Unverified]
    Urgent pointer: 0
    Options: (12 bytes), No-Operation (NOP), No-Operation (NOP), Timestamps
    [SEQ/ACK analysis]
    [Timestamps]
        [Time since first frame in this TCP stream: 0.000022253 seconds]
        [Time since previous frame in this TCP stream: 0.000022253 seconds]

No.     Time           Source                Destination           Protocol Length Info
     80 168.137529567  127.0.0.1             127.0.0.1             TCP      66     10002 → 38534 [ACK] Seq=68 Ack=88 Win=65536 Len=0 TSval=3259866463 TSecr=3259866416

Frame 80: 66 bytes on wire (528 bits), 66 bytes captured (528 bits) on interface 0
Ethernet II, Src: 00:00:00_00:00:00 (00:00:00:00:00:00), Dst: 00:00:00_00:00:00 (00:00:00:00:00:00)
Internet Protocol Version 4, Src: 127.0.0.1, Dst: 127.0.0.1
Transmission Control Protocol, Src Port: 10002, Dst Port: 38534, Seq: 68, Ack: 88, Len: 0
    Source Port: 10002
    Destination Port: 38534
    [Stream index: 1]
    [TCP Segment Len: 0]
    Sequence number: 68    (relative sequence number)
    [Next sequence number: 68    (relative sequence number)]
    Acknowledgment number: 88    (relative ack number)
    1000 .... = Header Length: 32 bytes (8)
    Flags: 0x010 (ACK)
    Window size value: 512
    [Calculated window size: 65536]
    [Window size scaling factor: 128]
    Checksum: 0xfe28 [unverified]
    [Checksum Status: Unverified]
    Urgent pointer: 0
    Options: (12 bytes), No-Operation (NOP), No-Operation (NOP), Timestamps
    [SEQ/ACK analysis]
    [Timestamps]
        [Time since first frame in this TCP stream: 59.638761392 seconds]
        [Time since previous frame in this TCP stream: 0.046718864 seconds]

No.     Time           Source                Destination           Protocol Length Info
    117 248.549583680  127.0.0.1             127.0.0.1             TCP      86     48184 → 10001 [PSH, ACK] Seq=54 Ack=1 Win=65536 Len=20 TSval=3259946875 TSecr=3259866416

Frame 117: 86 bytes on wire (688 bits), 86 bytes captured (688 bits) on interface 0
Ethernet II, Src: 00:00:00_00:00:00 (00:00:00:00:00:00), Dst: 00:00:00_00:00:00 (00:00:00:00:00:00)
Internet Protocol Version 4, Src: 127.0.0.1, Dst: 127.0.0.1
Transmission Control Protocol, Src Port: 48184, Dst Port: 10001, Seq: 54, Ack: 1, Len: 20
    Source Port: 48184
    Destination Port: 10001
    [Stream index: 0]
    [TCP Segment Len: 20]
    Sequence number: 54    (relative sequence number)
    [Next sequence number: 74    (relative sequence number)]
    Acknowledgment number: 1    (relative ack number)
    1000 .... = Header Length: 32 bytes (8)
    Flags: 0x018 (PSH, ACK)
    Window size value: 512
    [Calculated window size: 65536]
    [Window size scaling factor: 128]
    Checksum: 0xfe3c [unverified]
    [Checksum Status: Unverified]
    Urgent pointer: 0
    Options: (12 bytes), No-Operation (NOP), No-Operation (NOP), Timestamps
    [SEQ/ACK analysis]
    [Timestamps]
        [Time since first frame in this TCP stream: 244.714851005 seconds]
        [Time since previous frame in this TCP stream: 80.458994913 seconds]
    TCP payload (20 bytes)
Data (20 bytes)

0000  53 45 4e 44 4d 53 47 20 50 33 5f 47 52 4f 55 50   SENDMSG P3_GROUP
0010  5f 35 30 0a                                       _50.
    Data: 53454e444d53472050335f47524f55505f35300a
    [Length: 20]

No.     Time           Source                Destination           Protocol Length Info
    118 248.549603535  127.0.0.1             127.0.0.1             TCP      66     10001 → 48184 [ACK] Seq=1 Ack=74 Win=65536 Len=0 TSval=3259946875 TSecr=3259946875

Frame 118: 66 bytes on wire (528 bits), 66 bytes captured (528 bits) on interface 0
Ethernet II, Src: 00:00:00_00:00:00 (00:00:00:00:00:00), Dst: 00:00:00_00:00:00 (00:00:00:00:00:00)
Internet Protocol Version 4, Src: 127.0.0.1, Dst: 127.0.0.1
Transmission Control Protocol, Src Port: 10001, Dst Port: 48184, Seq: 1, Ack: 74, Len: 0
    Source Port: 10001
    Destination Port: 48184
    [Stream index: 0]
    [TCP Segment Len: 0]
    Sequence number: 1    (relative sequence number)
    [Next sequence number: 1    (relative sequence number)]
    Acknowledgment number: 74    (relative ack number)
    1000 .... = Header Length: 32 bytes (8)
    Flags: 0x010 (ACK)
    Window size value: 512
    [Calculated window size: 65536]
    [Window size scaling factor: 128]
    Checksum: 0xfe28 [unverified]
    [Checksum Status: Unverified]
    Urgent pointer: 0
    Options: (12 bytes), No-Operation (NOP), No-Operation (NOP), Timestamps
    [SEQ/ACK analysis]
    [Timestamps]
        [Time since first frame in this TCP stream: 244.714870860 seconds]
        [Time since previous frame in this TCP stream: 0.000019855 seconds]

No.     Time           Source                Destination           Protocol Length Info
    119 248.549846656  127.0.0.1             127.0.0.1             TCP      124    10001 → 48184 [PSH, ACK] Seq=1 Ack=74 Win=65536 Len=58 TSval=3259946875 TSecr=3259946875

Frame 119: 124 bytes on wire (992 bits), 124 bytes captured (992 bits) on interface 0
Ethernet II, Src: 00:00:00_00:00:00 (00:00:00:00:00:00), Dst: 00:00:00_00:00:00 (00:00:00:00:00:00)
Internet Protocol Version 4, Src: 127.0.0.1, Dst: 127.0.0.1
Transmission Control Protocol, Src Port: 10001, Dst Port: 48184, Seq: 1, Ack: 74, Len: 58
    Source Port: 10001
    Destination Port: 48184
    [Stream index: 0]
    [TCP Segment Len: 58]
    Sequence number: 1    (relative sequence number)
    [Next sequence number: 59    (relative sequence number)]
    Acknowledgment number: 74    (relative ack number)
    1000 .... = Header Length: 32 bytes (8)
    Flags: 0x018 (PSH, ACK)
    Window size value: 512
    [Calculated window size: 65536]
    [Window size scaling factor: 128]
    Checksum: 0xfe62 [unverified]
    [Checksum Status: Unverified]
    Urgent pointer: 0
    Options: (12 bytes), No-Operation (NOP), No-Operation (NOP), Timestamps
    [SEQ/ACK analysis]
    [Timestamps]
        [Time since first frame in this TCP stream: 244.715113981 seconds]
        [Time since previous frame in this TCP stream: 0.000243121 seconds]
    TCP payload (58 bytes)
Data (58 bytes)

0000  55 6e 61 62 6c 65 20 74 6f 20 73 65 6e 64 20 63   Unable to send c
0010  6f 6d 6d 61 6e 64 2c 20 6e 6f 20 63 6f 6e 6e 65   ommand, no conne
0020  63 74 65 64 20 73 65 72 76 65 72 73 2c 20 61 64   cted servers, ad
0030  64 69 6e 67 20 74 6f 20 6d 61                     ding to ma
    Data: 556e61626c6520746f2073656e6420636f6d6d616e642c20...
    [Length: 58]

No.     Time           Source                Destination           Protocol Length Info
    120 248.549867024  127.0.0.1             127.0.0.1             TCP      66     48184 → 10001 [ACK] Seq=74 Ack=59 Win=65536 Len=0 TSval=3259946875 TSecr=3259946875

Frame 120: 66 bytes on wire (528 bits), 66 bytes captured (528 bits) on interface 0
Ethernet II, Src: 00:00:00_00:00:00 (00:00:00:00:00:00), Dst: 00:00:00_00:00:00 (00:00:00:00:00:00)
Internet Protocol Version 4, Src: 127.0.0.1, Dst: 127.0.0.1
Transmission Control Protocol, Src Port: 48184, Dst Port: 10001, Seq: 74, Ack: 59, Len: 0
    Source Port: 48184
    Destination Port: 10001
    [Stream index: 0]
    [TCP Segment Len: 0]
    Sequence number: 74    (relative sequence number)
    [Next sequence number: 74    (relative sequence number)]
    Acknowledgment number: 59    (relative ack number)
    1000 .... = Header Length: 32 bytes (8)
    Flags: 0x010 (ACK)
    Window size value: 512
    [Calculated window size: 65536]
    [Window size scaling factor: 128]
    Checksum: 0xfe28 [unverified]
    [Checksum Status: Unverified]
    Urgent pointer: 0
    Options: (12 bytes), No-Operation (NOP), No-Operation (NOP), Timestamps
    [SEQ/ACK analysis]
    [Timestamps]
        [Time since first frame in this TCP stream: 244.715134349 seconds]
        [Time since previous frame in this TCP stream: 0.000020368 seconds]

No.     Time           Source                Destination           Protocol Length Info
    135 275.668724474  127.0.0.1             127.0.0.1             TCP      85     48184 → 10001 [PSH, ACK] Seq=74 Ack=59 Win=65536 Len=19 TSval=3259973994 TSecr=3259946875

Frame 135: 85 bytes on wire (680 bits), 85 bytes captured (680 bits) on interface 0
Ethernet II, Src: 00:00:00_00:00:00 (00:00:00:00:00:00), Dst: 00:00:00_00:00:00 (00:00:00:00:00:00)
Internet Protocol Version 4, Src: 127.0.0.1, Dst: 127.0.0.1
Transmission Control Protocol, Src Port: 48184, Dst Port: 10001, Seq: 74, Ack: 59, Len: 19
    Source Port: 48184
    Destination Port: 10001
    [Stream index: 0]
    [TCP Segment Len: 19]
    Sequence number: 74    (relative sequence number)
    [Next sequence number: 93    (relative sequence number)]
    Acknowledgment number: 59    (relative ack number)
    1000 .... = Header Length: 32 bytes (8)
    Flags: 0x018 (PSH, ACK)
    Window size value: 512
    [Calculated window size: 65536]
    [Window size scaling factor: 128]
    Checksum: 0xfe3b [unverified]
    [Checksum Status: Unverified]
    Urgent pointer: 0
    Options: (12 bytes), No-Operation (NOP), No-Operation (NOP), Timestamps
    [SEQ/ACK analysis]
    [Timestamps]
        [Time since first frame in this TCP stream: 271.833991799 seconds]
        [Time since previous frame in this TCP stream: 27.118857450 seconds]
    TCP payload (19 bytes)
Data (19 bytes)

0000  47 45 54 4d 53 47 20 50 33 5f 47 52 4f 55 50 5f   GETMSG P3_GROUP_
0010  35 30 0a                                          50.
    Data: 4745544d53472050335f47524f55505f35300a
    [Length: 19]

No.     Time           Source                Destination           Protocol Length Info
    136 275.669037712  127.0.0.1             127.0.0.1             TCP      208    10001 → 48184 [PSH, ACK] Seq=59 Ack=93 Win=65536 Len=142 TSval=3259973994 TSecr=3259973994

Frame 136: 208 bytes on wire (1664 bits), 208 bytes captured (1664 bits) on interface 0
Ethernet II, Src: 00:00:00_00:00:00 (00:00:00:00:00:00), Dst: 00:00:00_00:00:00 (00:00:00:00:00:00)
Internet Protocol Version 4, Src: 127.0.0.1, Dst: 127.0.0.1
Transmission Control Protocol, Src Port: 10001, Dst Port: 48184, Seq: 59, Ack: 93, Len: 142
    Source Port: 10001
    Destination Port: 48184
    [Stream index: 0]
    [TCP Segment Len: 142]
    Sequence number: 59    (relative sequence number)
    [Next sequence number: 201    (relative sequence number)]
    Acknowledgment number: 93    (relative ack number)
    1000 .... = Header Length: 32 bytes (8)
    Flags: 0x018 (PSH, ACK)
    Window size value: 512
    [Calculated window size: 65536]
    [Window size scaling factor: 128]
    Checksum: 0xfeb6 [unverified]
    [Checksum Status: Unverified]
    Urgent pointer: 0
    Options: (12 bytes), No-Operation (NOP), No-Operation (NOP), Timestamps
    [SEQ/ACK analysis]
    [Timestamps]
        [Time since first frame in this TCP stream: 271.834305037 seconds]
        [Time since previous frame in this TCP stream: 0.000313238 seconds]
    TCP payload (142 bytes)
Data (142 bytes)

0000  4d 65 73 73 61 67 65 73 20 74 6f 20 20 3a 20 50   Messages to  : P
0010  33 5f 47 52 4f 55 50 5f 35 30 0a 4d 65 73 73 61   3_GROUP_50.Messa
0020  67 65 73 20 66 72 6f 6d 3a 20 50 33 5f 47 52 4f   ges from: P3_GRO
0030  55 50 5f 32 30 0a 4d 65 73 73 61 67 65 20 66 65   UP_20.Message fe
0040  74 63 68 65 64 20 61 74 20 32 30 31 39 2f 31 30   tched at 2019/10
0050  2f 31 34 2f 31 35 2d 31 34 2d 32 34 3a 20 0a 53   /14/15-14-24: .S
0060  65 72 76 65 72 20 72 65 63 69 76 65 64 20 6d 65   erver recived me
0070  73 73 61 67 65 20 61 74 20 32 30 31 39 2f 31 30   ssage at 2019/10
0080  2f 31 34 2f 31 35 2d 31 33 2d 35 37 3a 20         /14/15-13-57: 
    Data: 4d6573736167657320746f20203a2050335f47524f55505f...
    [Length: 142]

